{
  "contract_version": "prism-assessment-v1.0",
  "inference_contract_version": "prism-inference-v2.0",
  "reference_id": "prism-assessment-ref-2026-10-06",
  "baseline_id": "prism-assessment-ref-2026-10-06/baseline",
  "detector_model_sha256": "2e4e72d3ca040b15718ad6b09ae4ac3069c38f5c1a389327bf6b38c4e2903725",
  "recording_status": "EVENTS_DETECTED",
  "error": null,
  "input": {
    "sample_rate": 8000,
    "n_samples": 96000,
    "duration_s": 12.0,
    "input_domain": "reference_dataset",
    "recording_id": "rec2018-01-23_10h45m44.127s.wav",
    "recorded_at": null
  },
  "baseline_domain_validated": true,
  "feature_order": [
    "spectral_centroid_mean",
    "spectral_flatness_mean",
    "spectral_centroid_std",
    "spectral_rolloff_std"
  ],
  "reference": {
    "alpha": 0.05,
    "categorical": true,
    "cut": 1.8297261539489305,
    "band": [
      1.6200762237720456,
      1.9724145879667279
    ],
    "n_reference_events": 318,
    "n_reference_sessions": 18,
    "feature_center": {
      "spectral_centroid_mean": 0.3705300390720367,
      "spectral_flatness_mean": 0.13224149495363235,
      "spectral_centroid_std": 0.039400866255164105,
      "spectral_rolloff_std": 0.08070974424481385
    },
    "feature_scale": {
      "spectral_centroid_mean": 0.027867408952116965,
      "spectral_flatness_mean": 0.029707026135921476,
      "spectral_centroid_std": 0.008977376704663007,
      "spectral_rolloff_std": 0.016905980072915563
    }
  },
  "n_events": 2,
  "n_scoreable": 1,
  "n_outside_reference_range": 0,
  "events": [
    {
      "event_id": 0,
      "start_time": 2.512,
      "end_time": 4.28,
      "duration_s": 1.7680000000000002,
      "start_sample": 20096,
      "end_sample": 34240,
      "detector_confidence": 0.9651438708257194,
      "detector_max_confidence": 0.9986772537231445,
      "window_count": 99,
      "scoreability": "SCOREABLE",
      "not_scoreable_reasons": [],
      "feature_values": {
        "spectral_centroid_mean": 0.3760787546634674,
        "spectral_flatness_mean": 0.12733003497123718,
        "spectral_centroid_std": 0.03429936245083809,
        "spectral_rolloff_std": 0.07792849838733673
      },
      "mean_rms": 0.177190899848938,
      "feature_deviations": {
        "spectral_centroid_mean": 0.1991112844744473,
        "spectral_flatness_mean": -0.1653299108407313,
        "spectral_centroid_std": -0.568262196424954,
        "spectral_rolloff_std": -0.16451254795531484
      },
      "aggregate_deviation": 0.3228643621337493,
      "reference_tail_probability": 0.987460815047022,
      "assessment": "WITHIN_REFERENCE_RANGE",
      "assessment_reliability": "STABLE",
      "segmentation_variants": 8,
      "segmentation_deviation_range": [
        0.2589754248586675,
        0.40491579368303815
      ],
      "dominant_feature": "spectral_centroid_std",
      "dominant_share": 0.7744570181234458,
      "reason": "deviation at or below the one-sided 95% upper reference limit (empirical reference-tail probability 0.987; largest deviation: spectral_centroid_std)"
    },
    {
      "event_id": 1,
      "start_time": 4.5120000000000005,
      "end_time": 4.712000000000001,
      "duration_s": 0.20000000000000018,
      "start_sample": 36096,
      "end_sample": 37697,
      "detector_confidence": 0.49006134271621704,
      "detector_max_confidence": 0.49006134271621704,
      "window_count": 1,
      "scoreability": "NOT_SCOREABLE",
      "not_scoreable_reasons": [
        "short_duration"
      ],
      "feature_values": {
        "spectral_centroid_mean": 0.3348084092140198,
        "spectral_flatness_mean": 0.12407217919826508,
        "spectral_centroid_std": 0.018728116527199745,
        "spectral_rolloff_std": 0.07547511905431747
      },
      "mean_rms": 0.24270811676979065,
      "feature_deviations": null,
      "aggregate_deviation": null,
      "reference_tail_probability": null,
      "assessment": "NOT_ASSESSED",
      "assessment_reliability": null,
      "segmentation_variants": 0,
      "segmentation_deviation_range": null,
      "dominant_feature": null,
      "dominant_share": null,
      "reason": "not scoreable: short_duration"
    }
  ],
  "interpretation": "aggregate_deviation a is the root-mean-square of robust z-scores of four spectral features relative to a global reference baseline. reference_tail_probability is the empirical reference-tail probability p = (1 + #{i : c_i >= a}) / (n + 1), where c_1..c_n are the reference deviations (n = n_reference_events; each reference inhalation scored by a baseline fitted without its own recording session): an empirical upper-tail probability of the reference deviation distribution with the +1 correction, not a hypothesis-test p-value. OUTSIDE_REFERENCE_RANGE means p <= 0.05, equivalently a above the one-sided 95% upper reference limit (reference.cut); WITHIN_REFERENCE_RANGE means p > 0.05. STABLE means the category is unchanged under resampling of the reference sessions and +/-1 detector-window boundary shifts; BORDERLINE means it changes under at least one of them. These statements describe acoustic deviation relative to the PRISM reference corpus only; they are not normal/abnormal, anomaly, technique-quality or clinical classifications."
}
